автор,нація,рахунок,назва,Позитивні відгуки,Негативні відгуки,Дата коментаря,Тип кімнати,Дата заїзду,Дата виїзду
"Dmytro","Ukraine","7","Ідеальний варіант на кілька ночей в центрі.","Сучасний ремонт. В самому центрі. Дуже зручно гуляти по місту. Доступ за кодом.","Було трохи прохолодно. Немає обігрівачу чи щось типу того. Немає холодильника. Дуже не вистачало.","2024-04-11","Small Double Room","2024-04-05","2024-04-07"
"Oksana","Ukraine","8","Добре для проживання  номер маленький  але чистий  дуже зручне розташування - в центрі міста.","Дуже зручне розташування- у центрі міста. Номер чистий  охайний.","Дуже погано працює витяжка  тому вологість підвищена  тому неприємний запах в ванній та не сохнуть рушники  навіть на вхідних дверях утворювався конденсат.","2024-04-07","Small Double Room","2024-03-15","2024-03-19"
"Ілля","Ukraine","8","","Гарний ремонт  чисто  є всі зручності  розташування.","З вікон сквозило","2024-03-26","Superior Double Room","2024-03-23","2024-03-26"
"Oleh","Ukraine","9","гарні апартаменти","дистанційне поселення  чистота  функціональність  продуманість у дрібницях  комфортабельність","","2024-03-06","Superior Double Room","2024-03-05","2024-03-06"
"Тетяна","Ukraine","7","Гарна квартира  але не для відпустки - бо шумно  і не для літа (немає кондиціонеру).","Гарне розташування  самостійне заселення і виселення.","Були з суботи по четвер  спокійний ранок був лише в неділю  всі інші дні близько 8-9 ранку починав лунати дуже неприємний звук  схожий на промислову пральну машину у квартирі зверху (я так думаю  що це повʼязано з плановим прибиранням номерів кожного дня). Спати було не можливо. А так як це була відпустка  було дуже прикро так і не виспатись.","2024-01-22","Superior Double Room","2024-01-06","2024-01-11"
"Artur","Ukraine","7","Вид из окон был ужасный на недостроенные дома разрушенные  управление телевизором было неудобным  там уже профиль пользо","Местоположение  большая кровать  душ","Вид из окон  телевизор  отношение к уборке","2023-12-22","Comfort Quadruple Room","2023-11-19","2023-11-25"
"Анастасия","Ukraine","8","","Розташування  хороший напір гарячої води  в номері всі необхідні зручності","В осінній період  коли ще нема опалення  в будинку дуже холодно.","2023-11-09","Comfort Quadruple Room","2023-10-13","2023-10-15"
"Cesar","Spain","5","","Todo esta nuevo","La mala atención de la responsable  la falta de indicaciones para encontrar el apartamento  la racaneria en el papel higiénico y el gel y champu y que el edificio esta en obras.","2023-10-28","Superior Double Room","2023-10-25","2023-10-27"
"Маша","Ukraine","9","Супер❤️🤩","Чисто  охайно  дуже кльовий ремонт для такого старого будинку  є все необхідне  самий центр що дуже зручно","Маленький мінус це відсутність мікрохвильовки і постійний шум турбінки якою розпилюють метал чи плитку під вікном","2023-10-15","Comfort Quadruple Room","2023-10-09","2023-10-11"
"Oksana","Ukraine","10","","Дуже зручне розташування","","2023-10-08","Deluxe Studio","2023-10-05","2023-10-08"
"Diana","Ukraine","8","В цілому все добре","Світла квартира  гарно оформлена","Заїзд в обід   а виїзд до 10  якось не дуже зручно   майже день проплачений пропадає","2023-10-05","Superior Double Room","2023-10-01","2023-10-03"
"Bogdan","Ukraine","6","","Чисто  зручно  дешево.","Тісно.","2023-09-20","Superior Double Room","2023-08-23","2023-08-24"
"Святослава","Ukraine","4","Дуже непрофесіональний персонал  неприємна жінка  яка не хотіла нічого пояснювати і плюс до всього підвищувала голос   к","Місце розташування","Під’їзд  персонал!","2023-08-31","Superior Double Room","2023-08-28","2023-08-30"
"Вінокуров","Ukraine","8","","Затишний номер. Чисто. Новий ремонт. Вигляд з вікна","Відсутність кондиціонера. Душновато. Вентилятор не рятує","2023-08-22","Superior Double Room","2023-08-20","2023-08-21"
"Ярослава","Ukraine","9","","","Дуже не вистачало кондиціонера.","2023-07-17","Comfort Quadruple Room","2023-07-16","2023-07-17"
"Sofiya","Ukraine","9","Компактний номер та надзвичайно зручне розташування в самому серці міста","В цілому  сподобалося проживання. Неймовірно зручне розташування  є все необхідне в номері  стильний мінімалістичний ремонт.","Номер менший  ніж було представлено на фото.","2023-07-07","Superior Double Room","2023-06-08","2023-06-10"
"Denis","Thailand","9","","Гарний інтерєр. В наявності все необхідне. Чисто. Чудова локація в центрі старого міста.","виселення до 10.00","2023-07-02","Deluxe Studio","2023-06-29","2023-07-01"
"Ксенія","Ukraine","10","Дуже задоволені","Все сподобалось   розташування просто😍","Було б дуже класно   якби був кондиціонер   або щось по типу вентилятора","2023-06-23","Superior Double Room","2023-06-21","2023-06-23"
"Тетяна","Ukraine","10","","Номер хороший чистенько зручно","Не повезло з сусідами і зранку розбудили ремонтні роботи","2023-05-29","Comfort Quadruple Room","2023-05-23","2023-05-24"
"Мартинюк","Ukraine","9","","Комфортно та зручно  в центрі міста","Вночі продувало з вікна  тому зняла 1 бал","2023-05-11","Superior Double Room","2023-05-08","2023-05-10"
"Kateryna","Ukraine","10","","Все чудово.","","2023-04-04","Superior Double Room","2023-03-23","2023-03-24"
"Max","Ukraine","8","","все сподобалось  чиста невиличка квартирка","не сподобався злив в душевій кабінці. вода витікає з душа аж в коридор.","2023-01-30","Superior Double Room","2023-01-28","2023-01-30"
"Polina","Ukraine","5","Можливо зупинитися  все охайно  але цей ремонтний пил відштовхує.","Розташування у місті Гарний ремонт Комунікація з робітником готелю  Фото відповідають реальності","Під‘їзд (він у стані ремонту) Запах газу Десь о 8 ранку спати було неможливо  бо почався якийсь нереальний гупіт На вікні у ванній кімнаті відсутня завіса У кімнаті де ліжко- дме холодом з вікна","2023-01-06","Superior Double Room","2022-12-29","2022-12-30"
"Olena","Ukraine","10","Зупиняюся тут вже вдруге і обовʼязково повернуся ще раз. Дуже затишно!","Місцерозташування у самому центрі міста  біля є все що вам тільки може знадобитися. Дуже зручно що немає потреби витрачати додатково час на те щоб забрати ключі. Наявність фена  праски та міні холодильника дуже порадувала.","Погана вентиляція у ванній кімнаті. Також у ванній було не дуже добре прибрано.","2025-03-14","Deluxe Studio","2025-03-09","2025-03-14"
"Сидоряк","Ukraine","4","Розчаровані !!!!!","Відпочивали не перший раз тут  тільки в більших номерах  в них було набагато зручніше  комфортніше і чистіше !!!!","Було холодно  дуло з вікон  рятувалися дуйчиком  дуже сиро і запах затхлий усього !за такі гроші не холодильника ні навіть ножа !!!були розчаровані  бо в більших номерах все набагато краще !!!!","2025-02-18","Small Double Room","2025-02-14","2025-02-18"
"Maria","Ukraine","5","","Розташування та сам дизайн номеру","Відсутність гарячої води та опалення цілий день!   З шостої ранку проводились ремонтні роботи  що дуже заважало відпочивати","2024-12-01","Small Double Room","2024-11-29","2024-12-01"
"Олександра","Singapore","7","не підійде  якщо плануєте спати вночі","- дуже чисто - номер виглядає як на фото - зручна локація в самому центрі  - є все необхідне для комфортного перебування","неможливо якісно виспатись  бо прямо під вікнами працює заклад  де грає музика і кричать люди до 23.00-0:00 закрити вікна немає можливості  бо в квартирі немає кондиціонеру (тільки маленький вентилятор)  після опівночі звуки вулиці стихають  але горить світло  що світить прямо у вікна і навіть жалюзі все одно пропускають його в кімнату","2024-08-17","Deluxe Studio","2024-08-12","2024-08-15"
"Anastasia","Ukraine","7","Гарне житло в гарной локації. Но треба хоть маленький холодильнік","Номер хоть і маленький  але чистий. Приемний ремонт і сучасний дизайн. Досить комфортне ліжко. Для мене і сина було достатньо місця. Чиста і охайна ванна кімната з душем. Гарно що є велико дзеркало.","Нема кондиціонера  а так як це останній поверх  то було ну дуже спекотно в липні. Вентілятор  якій є в преміщенні переодично відключався. Також прикро що нема холодильника. Не зовсім зрозумила по работі ТВ  ніякі канали не транслювались  можливо требо було щось вімкнути ще на пульті  алеж підказок ніде в номері не було.","2024-08-06","Superior Double Room","2024-07-08","2024-07-10"
"Sheshel","Ukraine","5","","Місце розташування","Були рушники зі смородом. Постіль теж віддавала поганим запахом. Набрав контакт  який був вказаний на букінгу о 8:10  потім вислухав  що я рано подзвонив та пояснив в чому питання.  Мені сказали  що таке не може бути. Але принесуть полотенця через годину. Другій раз в цих апартаментах зупинятись точно не буду.","2024-05-30","Superior Double Room","2024-05-29","2024-05-30"
"Юрiй","Ukraine","5","","Все новое и чистое с хорошим освещением в квартире  сделан евроремонт.","Подъезд  абсолютно весь в ремонте  пыльно и грязно без нормального освещения.  Квартира оказалась настолько маленькая  что невозможно в ней развернутся.  Забитый слив в душевой  раковина под наклоном  невозможно было поставить даже стакан  фен еле дует.","2023-02-01","Superior Double Room","2023-01-19","2023-01-28"
"Виктория","Ukraine","3","Не сподобалось","Сподобалось місце розтошування номера  в самому центрі Львова","Фотографії не збігаються с реальністю  дуже маленький номер  такого ще не бачили.  Все ліжко було в крихтах Чайник не працював","2023-01-20","Superior Double Room","2023-01-19","2023-01-20"
"Олег","Ukraine","1","","","Забронював  оплата пройшла.  При поселенні (а це вже була 23:00) номер не був підготовлений до проживання (не прибрано від попередніх мешканців). Набрав адміністратора  яка спершу запитала  чи я дивився на годинник:(  переселила мене в інший номер  який теж виявився не прибраний і не готовий. В кінцевому результаті мені повернули кошти і сказали шукати інше житло.","2024-06-29","Superior Double Room","2024-06-25","2024-06-26"
"Bogdana","Ukraine","1","НАЙГІРШЕ БРОНЮВАННЯ У МОЄМУ ЖИТТІ","","Кілька разів бронювала помешкання в даних апартаментах і все було гарно. Цього разу бронювала на три дні і весь відпочинок був зіпсутий через два фактори: це сусіди  які не давали спати! Вони так гучно шуміли після 00:00 і до самого ранку  що спати було неможливо. Ми одразу повідомили про це власницю  але нам не відповіли. А ось коли повідомили прибиральницю про те  що тріснула дощечка у ванній власниця нам одразу написала і попросила повернути кошти у розмірі 800грн!!! Вважаю  це перебільшена сума оскільки удар був головою об дощечку (вона супер незручна як у цьому номері так і в інших номерах даних апартаментів) і вона не могла тріснути так сильно… тобто вже була над ламаною. Враження дуже негативні і тепер навряд чи захочемо ще раз зупинитися і порекомендувати друзям та колегам дані апартаменти     ПРОДОВЖЕННЯ     Після відгуку вище до мене зателефонувала ПСИХІЧНО НЕВРІНОВАЖЕНА ВЛАСНИЦЯ і навіть не привітавшись почала на високих тонах з претензією до цього відгука мене ображати і вимагати пояснень такому відгуку! Замість того  щоб вислухати мене вона почала звинувачувати і переконувати  що шуму в юудинку не могло бути  але ночували в апартаментах я з хлопцем  який власне це все чув і просив залишии відгук. На цьому власниця не зупинилась і сьогодні після того  як я надала негативні оцінку на букінгу ЗНЯЛА З МОЄЇ КАРТКИ 500 ГРН БЕЗ ПОПЕРЕДЖЕННЯ І БЕЗ ПРИЧИНИ! Коли я їй зателефонувала вона ПОЧАЛА МЕНЕ ОБРАЖАТИ І НАЗИВАТИ ПОГАНИМИ СЛОВАМИ І НА ПИТАННЯ ЗА ЩО ВОНА ЗНЯЛА КОШТИ ВІДПОВІЛА  ЩО ЗА МОЇ ПОГАНІ І КРИВІ РУКИ ЯКІ ЗАЛИШИЛИ ПРОСТО ОЦІНКУ ВІДГУК ЗА ПРОЖИВАННЯ І ПОЧАЛА ПОГРОЖУВАТИ!!! я сказала  якщо вона продовжить я запишу розмову і вона буде притягнута до кримінальної відповідальності  після чого ВЛАСНИЦЯ СКИНУЛА ТРУБКУ!!!    Будь ласка  бережіть своє ментальне здоровя і ніколи НЕ БРОНЮЙТЕ АПАРТАМЕНТИ В ДАНОЇ ВЛАСНИЦІ! Вона ШАХРАЙКА!!! Спочатку НЕ ПО БІКІНГУ ПОПРОСИЛА ПЕРЕВЕСТИ ЇЙ 500 ГРН. ШАХРАЙКА!!!","2024-05-29","Small Double Room","2024-05-24","2024-05-27"
"Олександр","Ukraine","1","Неймовірно хамовиті власники.","Саме помешкання нове та чисте але таких на разі здається багато.","За 6 років подорожування по світу це саме жахливе відношення до клієнта яке я отримував.    При вʼїзді замінив що не було гарячої води (холодна була). Набрав помешкання для уточнення  мені сказали що зараз дізнаюсьться та перетелефонують. Чекав пів години  думаю за цей час можна вияснити з чим це повʼязано  не дочекавшись дзвінка набрав ще раз так як я спішив і мав знати що робити  у відповідь почав ""що ви надзвонюєте  я сказала що передзвоню."" Та кинули слухавку.    А розмова далі мене просто вразила. Зателефонувавши ще раз і в розмові було наступне:    «Ви взагалі далі України були?»   «Да я власниця  і що? Неподобається? забирайте гроші і зїжайте»  «Я вам що? Водоканал?»    І це все було підвищенням голосом.   Судячи з коментарів нижче можна зрозуміти що якщо ви не контактуєте з помешканням то все добре але як тільки звертаєтеся до помешкання то чуєте просто несамовите хамство.    Доречі  скоріш за все гарячої води небуло через ремонтні роботи в інших їхніх номерах поверхом нижче. З слів власника це проблема в водоканалі хоча холодна вода була і як я зрозумів в них гаряча вода іде від бойлера чи котла. Власниця спочатку казала зачекайте поки потече холодна вода щоб пішла гаряча бо 1 год назад вимикали гарячу воду. Тобто вони знали що квартиру будуть орендувати і всерівно проводили ремонті роботи повʼязані з гарячою водою в їх помешканнях а хотіли перекласти на водоканал. Правильно  хто такий клієнт? Зачекає.        Окремо для жіночки яка розмовляла від помешкання хочу дати відповідь на її запитання:  «Ви взагалі далі України були?» - Я був багатьох країнах світу і на різних континентах і знаю яке там обслуговування та якість.  Якщо виїхати кудись далі країн СНГ і мешкати не в самих дешевих помешканнях та готелях там власники дорожать своєю репутацією і намагаються максимально вирішити проблему при цьому відносяться до клієнта вічливо.","2023-12-27","Comfort Quadruple Room","2023-12-22","2023-12-24"
"Roksolana","Ukraine","4","","Зручне розташування у центрі Львова. Новий ремонт.","Мені написали невірний пароль від дверей. На щастя  через багато невірних спроб ввести пароль зазначений у листі я поміняла одну цифру та змогла зайти в апартаменти. Написавши це на пошту  мені передзвонили та нагрубили.","2023-10-13","Comfort Quadruple Room","2023-10-12","2023-10-13"
"Віталій","Ukraine","10","","Так сталося  що ми не заїхали в апартаменти. Кошти за незаїзд з нас не зняли  при тому  що ми не просили. Вдячні власникам апартаментів. Приємно вражені.","","2022-11-29","Superior Double Room","2022-11-28","2022-11-29"
"","Ukraine","10","","Чистота  місцерозташування","","2023-09-29","Superior Double Room","2023-09-25","2023-09-28"
"","Ukraine","10","","Місцерозташування чудове  маленька гарна кімната з новим ремонтом!!!","Дуже ранній час виїзду…","2023-09-03","Superior Double Room","2023-09-01","2023-09-03"
"","Ukraine","10","","все було чудово)) чисто прекрасне місце розташування. Для відпочинку парі дуже комфортно)","","2023-03-28","Superior Double Room","2023-03-24","2023-03-27"
"","Ukraine","6","","","Очень низкая душевая кабинка  для людей ростом 180+ она расположена максимально неудобно.Мой молодой человек за 5 дней проживания в этом номере заработал себе как минимум 7 сотрясений мозга.Нет кондиционера и москитной сетки на окнах.Безумно душно и очень много насекомых которых приходилось убивать раз в 5 минут  а потом ещё и лазить мыть потолки.За такую цену снимали номера покомфортнее (((","2023-08-22","Superior Double Room","2023-08-17","2023-08-22"
