автор,нація,рахунок,назва,Позитивні відгуки,Негативні відгуки,Дата коментаря,Тип кімнати,Дата заїзду,Дата виїзду
"Aleksandra","Ukraine","10","Романтично  зручно  душевно. Все сподобалось.","Розташування в центре міста. Новий  сучасний апартамент  все в наявності. Особливо зручна кухня. Охайно.","Треба розуміти  що квартири з історичним фасадом не завішуються кондиціонерами. Так і тут. Кондиціонера не була. А при відкритті вікна-шумно.  Це  так розумію  нюанс центральних апартаментів. ","2023-06-26","Deluxe Studio","2023-06-18","2023-06-22"
"Yuliia","Ukraine","10","Загалом все сподобалось. Зручне розташування — у самому центрі старого міста. Ремонт новий  сучасний  ліжко дуже м’яке і","Чисто  Акуратно  сучасно￼","Квартира Дуже маленька￼","2023-06-18","Superior Double Room","2023-06-04","2023-06-05"
"Діма","Ukraine","10","","Апартаменти розміщені в самому центрі Львова  на вулиці з купою ресторанів  кафе та інших цікавих закладів. Квартира чиста  охайна  з новим ремонтом. Є всі зручності: невеличка кухня з чайником і посудом  міні-холодильник  праска  телевізор з підключенням до Мегого та інше.. Безконтактне заселення та оплата житла. Персонал привітний та ввічливий  у всьому проконсультували та допомогли. Дуже задоволені відпочинком.","Все ок)","2023-06-18","Deluxe Studio","2023-06-16","2023-06-18"
"Анастасія","Ukraine","10","Можу сміло рекомендувати  як для подорожі туристичної  так і для робочої поїздки. Центр  зручно  все поруч  комфорт поме","Розташування  зручності апартаментів  комфорт  шумоподавленість вікон","Шум з вулиці при відкритті вікна 24/7","2023-06-10","Deluxe Studio","2023-06-08","2023-06-10"
"Oleksii","Ukraine","10","","чисто.Свежий ремонт.самый центр","раннее время выселения.10 утра… путешествую много такое впервые","2023-06-01","Superior Double Room","2023-05-30","2023-05-31"
"Julili92","Ukraine","10","","Удобно  что не нужно при заселении с кем-то общаться  перед заездом высылают электронный ключ по которому заходишь в апартаменты. Очень чисто  убрано на совесть. И конечно же расположение  так удобно  в самом центре города","Такого нет","2023-05-29","Comfort Quadruple Room","2023-05-18","2023-05-19"
"Ілля","Ukraine","10","","Чудове розташування. Система кодових замків. Комфортний номер  ліжко. Вид з вікон.","","2023-05-21","Comfort Quadruple Room","2023-05-15","2023-05-18"
"Волошин","Ukraine","8","Зручно  приємний інтер’єр  але ціна трохи зависока.","Дуже зручне розміщення всього і незважаючи на маленьку житлову площу  в ньому помістили все  для зручного перебування.","Незручні сходи  непродумана система освітлення  у під’їзді  ввечері. Ранішні ремонтні роботи зранку.","2023-05-11","Comfort Quadruple Room","2023-05-08","2023-05-11"
"Oleh","Ukraine","9","Позитивне","Безконтактне поселення  чистота у номері  смарт-атмосфера для короткотермінового відпочинку. Подбали навіть про шампунь і гель. Чисто  є чай  чайник  усі побутові зручності","Трохи страшно у під’їзді  бо йдуть ремонтні роботи  але це повністю компенсовує враження від самої кімнати. Фен може бути потужніший і закодований телевізор","2023-05-09","Superior Double Room","2023-05-07","2023-05-08"
"Artem","Ukraine","9","","Дизайн интерьера  качество ремонта.","Было холодно. особенно в ванной комнате.","2023-05-01","Superior Double Room","2023-04-27","2023-04-29"
"Nadiia","Ukraine","8","","Расположение  сам номер компактный  но есть все необходимое","На сайте не указоно этаж  я с огромным чемоданом не выбрала бы этот вариант  так 4 этаж  очень тяжело было мне его туда затащит. А если путешествуеш налегке  то вариант замечательный","2023-04-26","Superior Double Room","2023-04-23","2023-04-26"
"Oleh","Ukraine","10","чудові враження. Цінується приватність і бажання відпочити","супер система дистанційного заселення по кодовому замку  гарний інтер’єр та чудове місце розташування  заселення раніше придбаного на годину  що дуже зручно","немає","2023-04-21","Deluxe Studio","2023-04-15","2023-04-17"
"Е","Austria","9","","Дуже зручне розташування в історичній частині міста. Сподобався сучасний тип заселення з кодом без ключа.  Зручне ліжко та подушки","На жаль у будинку немає ліфта.","2023-03-23","Comfort Quadruple Room","2023-03-19","2023-03-23"
"Шатохіна","Ukraine","10","Дуже гарні апартаменти у центрі Львова.","Дуже чудові апартаменти. Чисто  затишно та в самому центрі міста.","Усе сподобалось.","2023-03-18","Superior Double Room","2023-03-15","2023-03-17"
"Dima","Ukraine","10","Стильно  модно  молодіжно)","Гарне місце  чисто  загалом все добре  рекомендую!","Лише можу виділити те що гучно трохи  чути сусідів.","2023-03-17","Deluxe Studio","2023-03-14","2023-03-17"
"Khalilova","Ukraine","10","все сподобалося","чисті  гарні апартаменти","","2023-03-15","Superior Double Room","2023-03-12","2023-03-15"
"Артур","Ukraine","10","","Дуже чистий та затишний номер. Стильний ремонт  немає сторонніх запахів.","","2023-03-13","Comfort Quadruple Room","2023-03-10","2023-03-12"
"Igor","Ukraine","10","","Чудове розташування","","2023-02-21","Comfort Quadruple Room","2023-02-10","2023-02-11"
"Dima","Ukraine","9","Маленькая  но отличная квартирка.","Расположение прекрасное  в самом центре. Номер чистый  тёплый  достаточно освещения  розеток. Хорошая душевая кабина. Есть чайник  кофе  чай. Уютно.","Все время прибывания интернет ловил очень слабо  иногда пропадал. Квартира очень маленькая  скорее даже это можно назвать комнатой.","2023-02-11","Superior Double Room","2023-02-03","2023-02-07"
"Yana","Ukraine","10","Дуже затишно та кгмфротно  є світло","вид з вікна та розташування","відсутність чогось де можна розігріти їжу","2023-02-08","Comfort Quadruple Room","2023-02-02","2023-02-06"
"Vita","Ukraine","10","","все було круто  номер зручний  місцерозташування гарне  все поруч","","2023-01-30","Superior Double Room","2023-01-27","2023-01-29"
"Maryna","Ukraine","10","","- компактна кімната  є все необхідне. для 2 людей ідеально.  - додаткові комплекти ковдр та подушок. - наявність 2 робочих місць за столом - достатньо точок світла та розеток - чудова локація в самому центрі  але тихо","","2023-01-27","Comfort Quadruple Room","2023-01-22","2023-01-27"
"Дарина","Ukraine","10","","Розташування  комфортне ліжко  лаконічність квартири","В 11 квартирі  на краннику умивальника не правильне розташування кольору горячої води. Через те  день думала  що гаряча вода відсутня 😄","2023-01-19","Superior Double Room","2023-01-15","2023-01-18"
"Ковалёва","Ukraine","10","","все супер  чудове місце розташування  квартира охайна чиста  гарний ремонт  весь час було тепло і світло","","2023-01-13","Comfort Quadruple Room","2023-01-09","2023-01-13"
"Євген","Ukraine","10","","Затишно","","2023-01-08","Comfort Quadruple Room","2023-01-04","2023-01-05"
"Vitalii","Ukraine","10","","Новий ремонт   розташування в самісінькому центрі   доступ до усіх локацій та магазинів в пішій доступності. У номері є чайник з кавою та чаєм","На перший день не виставили пляшки води . Хоча би 2 по 0.5 було би дуже гарно  Все інше дуже добре )","2023-01-07","Superior Double Room","2023-01-03","2023-01-06"
"Станіслав","Ukraine","7","","Удобная мебель.","Телевизор стоит для украшения  а именно. Как можно не заплатить за телевидение   а оставить только очень неудобный Ютуб ? Неудобный тем  что вводить в поиск пультом очень долго и фильмы не посмотреть в Ютубе в норм качестве. Не понравилась пыль вверху шкафа. Так вышло   что прятали туда подарок от ребенка   чтоб презентовать позже. В общем там такое ощущение  что протирают раз три месяца  а это привет аллергикам.","2023-01-05","Deluxe Studio","2023-01-02","2023-01-04"
"Шевчук","Ukraine","10","","Місце розташування та чистота","","2022-12-30","Comfort Quadruple Room","2022-12-28","2022-12-30"
"Helen","Ukraine","10","нам було затишно і зручно =)","дуже зручне розташування  буквально за сто метрів від Площі Ринок є усі зручності  свіжий ремонт дуже хороша система пін-кода замість ключа: не треба з ним носитися і боятися загубити  або можна спокійно розділитися і не домовлятися щодо ключа  також заїзд та виїзд самостійний  ні під кого не треба підлаштовуватись завжди було світло  опалення і гаряча вода  що в наш час майже розкіш","номер дійсно дуже маленький  нам було ок  але якщо ви крупна людина  то може бути тіснувато","2022-12-28","Superior Double Room","2022-12-24","2022-12-28"
"Matiukha","Ukraine","10","","Зупинялись на одну ніч  дуже задоволені апартаментами. Вразила чистота номеру і надзвичайно комфортне ліжко. Однозначно буду рекомендувати друзям та знайомим!","","2022-12-23","Comfort Quadruple Room","2022-12-21","2022-12-22"
"Anastasiia","Ukraine","10","","Все чудово  світло не вимикали  чисто та є всі зручності.","Нема пральної машинки  якщо для вас це важливо.","2022-12-20","Deluxe Studio","2022-12-16","2022-12-19"
"Viktor","Ukraine","10","Із задоволенням ще приїду в ці апартаменти. Не пожалкуєте;)","Наш номер №12 був на 4-му поверсі.    Все якісне і нове) Простора душова  зручне ліжко і чудова ковдра. Все необхідне є в наявності. Працює опалення і було тепло навіть при -12 за вікном. Зручно за кодом мати доступ в номер і під'їзд. Нам пощастило  що взагалі не зникало світло за три дні(хоча поруч його не було). Доволі гарний інтернет.","Номер я так зрозумів що дуже новий і все дуже якісне але не плазма)) Смарт телевізор тупив і нічого не грузив. Дивилися фінал ЧС на айпаді  добре  що вай-фай нормальний.     Нажаль в номері не було води  щоб приготувати чай або каву  яка доречі безкоштовна і є в наявності. Можливо у Львові воду можна пити з крану.     Сам під'їзд дуже холодний  бо є розбиті вікна  які можна пофіксити  а краще замінити на сучасні.     Вірю  що там буде все на висоті  бо на другому поверсі роблять ремонт ще в 4 номерах.","2022-12-20","Comfort Quadruple Room","2022-12-17","2022-12-19"
"Oleh","Ukraine","10","дуже приємно","дизайн","нічого)","2022-12-16","Superior Double Room","2022-12-15","2022-12-16"
"Антон","Ukraine","10","","Чудовий номер. Мабіть тільки закінчили ремонт. Все нове та в суперовому стані. Найцентральніше розташування  1 квартал і ти на Площі Ринок. Все сподобалось!","Час виселення занадто рано  о 10:00  хотілось трішечки більше. Хоче це не суттєво.  Обов'язково повернемося!","2022-12-16","Comfort Quadruple Room","2022-12-09","2022-12-11"
"Альона","Ukraine","10","буду радити знайомим","дуже зручне місцерозташування  дизайн апартаментів  чистота номеру.","не працював телевізор  не знайшли шампунь  гель для душу (тільки мило для рук).","2022-12-12","Deluxe Studio","2022-12-09","2022-12-12"
"Serw","Ukraine","9","Прекрасне місце","Дизайн  квартира хоч і невеличка  але все виглядає приємно на око  все в стилі лофт. Зручне  велике ліжко. Просторий душовий простір. Чай і каву лишили власники. Магнітні механізми на тумбочках. Не треба ключа  щоб відкрити двері  під'їзд і кімната використовують термінал. На підвіконні є місце  щоб сидіти і грітись в коцику. Коцику також є в номері.","Одна чайна ложка. Не було губки  щоб мити посуд  принаймні я її не знайшов. Загалом все було добре.","2022-12-04","Deluxe Studio","2022-12-02","2022-12-04"
"Gvido","Italy","10","чудове","так","все","2022-11-30","Superior Double Room","2022-11-27","2022-11-28"
"Natalia","United Kingdom","10","","Все чудово. Чиста білизна  комфортні ліжка.  Доволі простора кімната. Приємний кутоточок на вікні сподобався дитині.","Відсутність ліфта це великий мінус  особливо коли важкі валізи. Ну і краєвид на внутрішній двір не файний.","2025-04-03","Comfort Quadruple Room","2025-04-01","2025-04-03"
"Олександр","Ukraine","8","","Компактно уютно симпатично","Зимно в кімнаті  а весь час з дуйчиком не будеш  але  + шо він є","2025-01-24","Small Double Room","2025-01-20","2025-01-21"
"Alina","Ukraine","8","","Цена  размещение и уют","Рядом возле окон была стройка и постоянно шумели","2025-01-17","Small Double Room","2025-01-14","2025-01-17"
"Торкотюк","Ukraine","8","","Сподобався сучасний дизайн розташування і вид з вікна💔 безконтактний заїзд блекаут штора👌🏻","В номері було холодно тапок не було це розчарувало підлога була холоднюща","2025-01-13","Superior Double Room","2025-01-03","2025-01-05"
"Yana","Ukraine","2","","Расположение","Было очень холодно  дуло с окна всю ночь! Спать было невозможно  слава богу что мы остановились в этих апартаментах только на 1 ночь!(","2025-01-06","Superior Double Room","2025-01-04","2025-01-05"
"Volokhata","Ukraine","9","В захваті від місця розташування  чистоти та комфорту в помешканні","","Холодно","2024-12-13","Small Double Room","2024-12-07","2024-12-09"
"Катерина","Ukraine","3","","Саме помешкання симпатичне та чисте","Було дуже холодно!!Власниця відповіла на дзвінок до заселення а після того  як отримала гроші на дзвінки не відповідала!Як тільки зайшли в кімнату було тепленько і теплі батареї!За деякий час ми зрозуміли що стає прохолодно спробували батареї-а вони абсолютно холодні!Пробували підкручувати але ефекту це не давало!І такими були увесь час!Було холодно!Ми телефонували декілька разів на контактний номер щоб поцікавитись чому так але вона більше не відповідала.Розчарування!Ми з дівчатами змерзли!Заселення було на 3-ох людей а рушників було лише для двох!","2024-12-01","Comfort Triple Room","2024-11-16","2024-11-17"
"Анастасія","Ukraine","3","За ці гроші можна знайти краще помешкання і відносно ціни і відносно умов.","Чистота і без ключовий доступ","Приміщення дуже мале  як на такі гроші. В номері тхне каналізацією  чути знадвору шум  хоча стоять металопластикові вікна. Чутно як відчиняється і зачиняється кафе- гупає  щось носить персонал. Якщо ви захочете поспати довше ніж 7 ранку і у вас чутливий сон  вам це не вдасться.","2024-11-03","Small Double Room","2024-10-31","2024-11-02"
"Давид","Ukraine","8","Все круто!","Дуже зручне місцерозташування  є все для зручного проживання  але чутно все що відбувається у підʼїзді","","2024-10-15","Comfort Quadruple Room","2024-10-13","2024-10-14"
"Ліля","Ukraine","8","Хороший варіант на свою ціну та якість","Зручна локація  є фен  чайник та потрібний посуд. Номер чистий і приємно пахне) В невеликій кімнаті вмістилось усе необхідне. Чудовий чистий санвузол з гарячою водою. Заселення і виселення самостійне  без дзвінків і переговорів)","Дивний запах від рушників  враження  що їх вологими склали і вони отримали такий запах. Хоча вони були чисті. Також 1 рулон туалетного паперу на всі дні проживання (для 1 чи 2 днів це гуд  але якщо людей і днів  більше  то доведеться купляти) + в момент мого проживання за вікном були ремонтні роботи  про які не попередили  тому підйоми були раніше  ніж планувалось.","2024-08-21","Small Double Room","2024-08-16","2024-08-20"
"Любов","Ukraine","7","Якщо врахуєте мої претензії номер буде чудовим.","Тільки те  що номер новий і чистий.","При вході в приміщенні з правої сторони стоїть гостинка так от їїї треба переробити.Зменшити шафу для одягу і добавити в вільну секцію хоча б барний холодильник.Що там немає мікроволновки це пів біди а от як без холодильника.Для пари яка бажала відпочити і погуляти по місту з ночівлею 5 ночей підсунули номер без кухонних зручностей.Але сам номер в гарному стані.","2024-08-16","Small Double Room","2024-08-09","2024-08-14"
"Віталій","Ukraine","10","Супер","Інтерʼєр  місце розташування  наявність кави і чаю)","Мало місця в туалеті","2024-07-28","Superior Double Room","2024-07-26","2024-07-27"
"Блажко","Ukraine","10","Усе сподобалось чисто та доступно","Дуже чисто супер легке заселення усе є для зручності хороше місце розташування","Було трішки жарко але в апартаментах був вентилятор","2024-07-17","Deluxe Studio","2024-07-14","2024-07-16"
"Nina","Ukraine","8","Майже все ідеально  я задоволена","Квартира знаходиться у центрі міста. В квартирі є все необхідне. Чисто  охайно. Зі смаком зроблений ремонт  нічого зайвого.","Трошки замало місця для двох.","2024-06-28","Superior Double Room","2024-06-26","2024-06-28"
"Nataliia","Ukraine","8","","","В номері дуже сильно холодно  тапочків немає  виїзд з номеру дуже рано в 10:00","2024-05-18","Comfort Triple Room","2024-05-16","2024-05-17"
"Antonina","Ukraine","8","","Стильний ремонт  чудове місцерозташування","Жахливо воняли рушники  дуже висока вологість.","2024-05-11","Small Double Room","2024-05-08","2024-05-11"
"Sled","Ukraine","10","","Хороший варіант для двох  в самому центрі  зручно що немає ключів  номер чистий  сучасний  хоч і не великий  але для одного двох осіб чудово.","","2024-05-07","Superior Double Room","2024-04-27","2024-05-03"
