автор,нація,рахунок,назва,Позитивні відгуки,Негативні відгуки,Дата коментаря,Тип кімнати,Дата заїзду,Дата виїзду
"Daria","Ukraine","8","A great option for vocation and short-term stay","Good location  nice interior of the apartment","Audibility between rooms  no washing machine","2025-04-21","Superior Double Room","2025-03-23","2025-03-25"
"Kseniya","Ukraine","10","","Contactless check-in & check-out  pets-friendly  perfect location  bar and restaurants close to the apartment  comfortable planning","No elevator  difficulties with parking in the city center (more but advantages of staying in the center)","2025-04-06","Comfort Quadruple Room","2025-03-21","2025-03-23"
"Andrii","Ukraine","9","","Very small  but good","","2023-04-08","Superior Double Room","2023-02-22","2023-02-24"
"Dovbetska","Ukraine","9","","Location  easy check-in and check-out  cute modern room","Smelly towels","2025-03-02","Superior Double Room","2025-02-27","2025-03-01"
"9ka","Ukraine","10","Perfect location!!!","The location is perfect. Right in the middle of the old town  just a block away from the Market Square. There are so many restaurants  shops and architectural landmarks nearby!   Also  the room was really stylish!","Not enough toilet paper  considering it's quality. Also    a couple of trash bags would come in handy.","2024-07-18","Small Double Room","2024-07-12","2024-07-15"
"Юлия","Ukraine","9","We enjoyed our stay a lot. The apartment is small but clean and comfy. The location is great.","The location is great  just in the heart of the old city.","A bit too loud at night because of the neighboring restaurants.","2023-05-17","Superior Double Room","2023-05-13","2023-05-16"
"Ibrahim-radmil","Ukraine","1","Omg !!! AWFUL THEY RUINED MY BIRTHDAY!","Nothing","Everything  the owner is a sick lady that screams 24/7   and always wants to put her nose in your business  awful facilities  don’t know what happened because before it was great and now it awful !!!!","2024-10-07","Comfort Quadruple Room","2024-09-17","2024-09-21"
"Анна","Ukraine","10","Все сподобалось  рекомендую","Дуже зручне розташування. Все чисто і пролумано до дрібниць","Слабувата звукоізоляція","2025-04-22","Deluxe Studio","2025-03-14","2025-03-16"
"Victoriya","Ukraine","10","","Надзвичайно гарне місце розташування  чисто та комфортно. В номері є все необхідне.","","2025-04-15","Comfort Triple Room","2025-04-11","2025-04-13"
"Анна","Ukraine","10","","Дуже сподобалися апартаменти!  Зручне розташування   легко знайти помешкання і комфортно гуляти центром міста! Поряд є кілька варіантів парковок (платних)  машину лишити не проблема і недалеко нести речі. Загалом у Львові буваємо часто  але це помешкання одне з кращих  яке траплялось! З радістю повернемось родиною саме в цю квартиру!","","2025-04-11","Comfort Quadruple Room","2025-04-09","2025-04-11"
"Анна","Ukraine","1","Оберіть інший варіант житла","Свіжий ремонт та місце розташування. Більше немає за що віддавати тут гроші.","Хороші відгуки - омана. Адміністраторка не може нормально спілкуватися з клієнтами. У ванній кімнаті вікно без фіранок через яке ваші нюдси бачитиме весь Львів.   Кімната замала для двох людей. Дуже шумно: чути сусідів  веселощі в закладах та будівництво. Страшенний протяг з вікна над ліжком  тому готуйтеся поїхати звідси із запаленням горла/вух/носа чи очей. Через протяг у холодні пори року в кімнаті холодно (обігрівач у кімнаті вас не врятує)  а влітку більше всього спаритеся там  бо кондиціонер відсутній.   Речі після виїзду немає можливості лишити в камері схову  бо тут зручності клієнтів нікого не цікавлять.","2025-04-10","Superior Double Room","2025-04-06","2025-04-09"
"Olga","Ukraine","10","","Чудові апартаменти! 🥰 Чисто  затишно  свіжий ремонт  зручне ліжко  відмінне розташування у самому центрі!  Фото відповідає реальності на усі 100% Дуже зручне безконтактне поселення-не витрачаєш час на реєстрацію та забір ключів Однозначно повернусь ще!!!","","2025-04-07","Comfort Triple Room","2025-04-06","2025-04-07"
"Вікторія","Ukraine","10","","Охайні  чисті  зручні апартаменти.Сподобалося","","2025-04-02","Superior Double Room","2025-03-26","2025-03-28"
"Соф‘я","Ukraine","8","","Чудовий номер   дуже чистий та охайний   дуже зручна локація   тільки було досить прохолодно   в номері є дуйчик але він не сильно рятує","","2025-04-01","Small Double Room","2025-03-26","2025-03-28"
"Radyslav","Ukraine","10","","Все супер  не хватало за эту цену одноразовых щеток почистить зубы  и одноразовых тапок  а так все чисто постель без пятен и приятно пахнет  бонусом нам написали что мы можем заселиться на час раньше  рекомендую!","","2025-03-30","Comfort Triple Room","2025-03-29","2025-03-30"
"Гуцуляк","Ukraine","10","","Житло супер  розміщення також. Задоволені на 100%","","2025-03-29","Small Double Room","2025-03-28","2025-03-29"
"Alisa","Ukraine","9","","Вдруге залишаюсь в цьому місці - все подобається. Окремо дякую за можливість заїхати раніше. Єдиний мінус: дуже холодно  на жаль  навіть «дуйчик» не допомагав","","2025-03-26","Small Double Room","2025-03-23","2025-03-26"
"Anton","Ukraine","10","","Гарний ремонт  чудове освітлення в номері.","Відсутність мікрохвильовки.","2025-03-04","Comfort Quadruple Room","2025-02-28","2025-03-02"
"Lidiia","Ukraine","10","","Фото відповідають реальності  квартирка маленька але дуже зручна  є абсолютно все. Самостійне заселення порадувало  дуже зручно.  Місце в самому центрі  при тому не чути трамвай  виспались чудово.   Дякую!","","2025-02-24","Deluxe Studio","2025-02-22","2025-02-23"
"Дарина","Ukraine","10","","Гарний свіжий ремонт","","2025-02-16","Superior Double Room","2025-02-13","2025-02-16"
"Julia","Ukraine","10","у Львові я була вперше.. дякую Марині що допомогла зорієнтуватися на місці та була завжди на звʼязку) щиро вдячна за ці","Зручне розташування квартири з гарним видом з вікна.. в квартирі було затишно та комфортно  чисто та без сторонніх запахів  сучасний інтерʼєр і навіть квіти в горщику  наче як вдома..  все було справним.. гарячий душ з працюючою витяжкою  можливість випити чаю чи кави вдома  навіть попрасувати одяг якщо зібрався до театру)  Щиро вдячна вам  так тримати!!","","2025-01-31","Superior Double Room","2025-01-11","2025-01-13"
"Oksana","Ukraine","10","","Все сподобалось  житло в самому центрі  номер маленький але комфортний. Все необхідне для проживання є","","2025-01-21","Small Double Room","2025-01-18","2025-01-20"
"Marina","Ukraine","10","","Усе","Нема наріканій","2025-01-17","Deluxe Studio","2025-01-14","2025-01-16"
"Mariya","Ukraine","10","","Вдале місце розташування  дуже чисте і продумане житло  наче продумано для себе з любовʼю а не для комерції.","Для 2х потрібне більше покривало  бо малувато. Був додатковий пледик  але ми користувалися своїм. Також гачок при прихожі не дуже надійний  падає  потрібно його замінити.","2025-01-15","Superior Double Room","2025-01-12","2025-01-14"
"Nikita","Ukraine","9","Если хочешь в центре и красиво то класс","Локация  чистота","Единственный минус это - 1 небольшой рулончик туалетной бумаги  пришлось докупать.","2025-01-11","Deluxe Studio","2025-01-04","2025-01-07"
"Світлана","Ukraine","10","","Все було супер. Невеличкий але затишний та комфортний номер . Чистий та охайний. Зручне розташування   все поряд","","2025-01-07","Small Double Room","2025-01-05","2025-01-07"
"Альона","Ukraine","10","","Розміщення  оздоблення квартири","Було прохолодно","2025-01-01","Deluxe Studio","2024-12-15","2024-12-16"
"Sn","Ukraine","9","Чудове розташування  центр міста  чистота  якісний ремонт  лояльність до домашніх улюбленців  рекомендую.","Розташування  дозвіл перебування з домашнім улюбленцем  свіжий ремонт.","Рушники (їх давно час замінити)  відсутність сходинки яка розділить душ від іншої частини ванної кімнати.","2024-12-06","Superior Double Room","2024-11-30","2024-12-04"
"Anton","Ukraine","10","Прекрасное место  сюда хочется вернуться!","Понравилась полная автономность заселения и выселения из номера  без контактов с людьми  встреч и ожиданий. Номер чистный и комфортный  есть всё необходимое  ни в чем дополнительном не нуждались. Вид из окна был прекрасный!","Написать чего-то отрицательного не представляется необходимым  всё прошло прекрасно","2024-11-30","Deluxe Studio","2024-10-28","2024-11-01"
"Tincev","Ukraine","7","","","Було холодно тому що час від часу опалення то було то не було не було одноразових тапок та не вистачає смітника у кімнаті або коридорі","2024-11-26","Superior Double Room","2024-11-23","2024-11-25"
"Євгеній","Ukraine","5","","Локація","Холодні батареї та холодна вода","2024-11-17","Comfort Quadruple Room","2024-11-15","2024-11-16"
"Марія","Ukraine","10","","Сподобалося місцерозташування  вийшов і ти у вирі подій! Стан жила - чисто  доглянуто  зроблено з розумом та любов'ю до людей. Все необхідне в наявності!  Дякую  що допомогли провести відпустку в гарному місці і в гарних умовах!","Єдине  що - розкладний диван короткий для зросту 165 см  ноги звисали)))","2024-11-15","Deluxe Studio","2024-11-04","2024-11-08"
"Maria","Ukraine","10","Центр города  модный дизайн  хорошая мебель♥️ Главное  приятное дополнение было сахар  чай  кофе и посуда для приготовле","Чудесное месторасположение  центр самый центр )","Такого нет!!!","2024-11-05","Comfort Triple Room","2024-11-01","2024-11-04"
"Anna","Ukraine","10","","Дуже гарне місцерозташування  самісінький центр. Апартаменти дуже комфортні  неймовірно чисто. Є все для зручного знаходження: фен  праска  шампунь  мило  гель для душу. Ми зупинялись в апартаментах без кухні  але був чайник (що +). З задоволенням буду зупинятися ще!","","2024-10-27","Small Double Room","2024-10-25","2024-10-27"
"Марія","Ukraine","9","","Дуже комфортний та затишний номер","Ввечері запрохолодно","2024-10-25","Superior Double Room","2024-10-24","2024-10-25"
"Maksym","Ukraine","10","Дуже добре","Все сподобалося   крім того що треба було виїхати до 10-Ї години","треба було виїхати до десятої години  хочаб до одинадцятої було-б краще.","2024-10-22","Deluxe Studio","2024-10-20","2024-10-22"
"Дмитро","Ukraine","10","","","Відстутність капців.","2024-10-18","Comfort Quadruple Room","2024-10-15","2024-10-17"
"Oleh","Ukraine","9","Рекомендую зупинятися","Безконтактне поселення  смарт-апартаменти  зручність  продуманість","-","2024-10-04","Superior Double Room","2024-10-02","2024-10-03"
"Kinashevska","Ukraine","10","","Дуже затишно комфортно чисто)","","2024-10-04","Superior Double Room","2024-10-01","2024-10-03"
"Anastasia","Ukraine","10","З радістю зупинюся тут наступного разу.","Все супер. Чисто  зручно  розташування плюс  вид з вікна красивий.","Єдиний мінус - неприємний запах від рушників  які розповсюджується на всю ванну кімнату.","2024-10-02","Superior Double Room","2024-09-30","2024-10-02"
"Коротка","Ukraine","10","","Дуже стильна та сучасна квартира  все чисто та є все для комфортного проживання. Дуже зручно  що все на кодах. Співвідношення ціни і якості чудове  я не очікувала  що за такі кошти можна жити в самому центрі Львова😍 Дякую  обовʼязково повернемося ще","","2024-09-30","Superior Double Room","2024-09-23","2024-09-25"
"Nataly","Ukraine","10","Повністю задоволені  рекомендуємо.","Відмінне розташування і доступність локацій  чистота апартаментів.","Не знайшли недоліків.","2024-09-24","Deluxe Studio","2024-09-21","2024-09-24"
"Tetiana","Ukraine","9","","Розташування супер","","2024-09-23","Small Double Room","2024-08-24","2024-08-26"
"Хижняк","Ukraine","10","Найкращий вибір для відпочинку на двох)","Гарно та комфортно)","Все сподобалось!!!","2024-09-22","Small Double Room","2024-09-16","2024-09-21"
"Марія","Ukraine","10","Дуже легко дістатись у апартаменти та з апартаментів  дуже комфортно  є всі зручності  обов’язково сюди повернемось","Дуже чисто  свіжий інтерʼєр та дуже дуже зручне розташування","Недоліків немає","2024-09-21","Deluxe Studio","2024-09-18","2024-09-21"
"Yuliіa","Ukraine","10","","Хороша локація  чисте та комфортне приміщення  доступна комунікація із господарями. Однозначно рекомендую!","","2024-09-14","Deluxe Studio","2024-08-15","2024-08-16"
"Яна","Ukraine","10","Якщо будемо їхати до Львова то тільки сюди!","Місце розташування просто супер!  Все було чисто🤌","Одне що могла б порекомендувати- замінити подушки 😅 дуже не зручні🥲","2024-09-11","Deluxe Studio","2024-09-08","2024-09-11"
"Юлія","Ukraine","10","Обовʼязково повернемось ще!","Дуже сподобалось помешкання.Чисто  охайно  тепло та з сучасним ремонтом.Зручне розташування та зручне заселення та виселення.Однозначно рекомендую!!!","","2024-09-07","Comfort Quadruple Room","2024-09-04","2024-09-06"
"Anna","Ukraine","7","номер чистий  чудова локація  гарний ремон і легке заселення. виселення о 10:00  що зустріла вперше  тож варто на це зва","чисто  чудовий свіжий ремонт","відсутність кондиціонера  ремонтні роботи о 8 ранку вихідного дня (хоч від власників це не залежить  та враження зіпсувало)","2024-09-04","Deluxe Studio","2024-08-30","2024-08-31"
"Alla","Ukraine","10","","Зручне розташування  цілодобовий паркінг  додаткові послуги прання   заселення в зручний для клієнта час","","2024-08-27","Comfort Triple Room","2024-07-26","2024-07-27"
"Виктория","Ukraine","8","В загальному чисто  дуже зручне розташування  сподобалось заселення по кодовому замку - це дуже зручно.","Дуже сподобалось розташування апартаментів  ціна  чистота","Було дуже шумно  через ремонтні роботи з 9 години ранку під вікном.","2024-08-26","Small Double Room","2024-07-19","2024-07-24"
"Liliia","Ukraine","10","Чудове місце розташування. Вікна у двір. Тихо . Є все необхідне  гарний ремонт. Все було чудово. Рекомендую.","Місце розташування. Чисто. Тихо","","2024-08-24","Comfort Quadruple Room","2024-07-05","2024-07-06"
"Роман","Ukraine","8","все добре 👍","меблі","немає кондиціонеру  слабий вентилятор","2024-08-19","Superior Double Room","2024-08-14","2024-08-19"
"Alina","Ukraine","10","Дякую  із задоволенням повернемось!","Супер локація  гарний ремонт  дуже затишно. Все  що потрібно було в номері  навіть праска. Зручні замки та самостійне заселення.","Краще було б мати фен з регулюванням температури  бо цей був по типу готельних  що кріпляться на стіну  і може псувати волосся.  Холодильник зовсім трохи був холодний  але нам було ок на пару днів.","2024-08-19","Comfort Quadruple Room","2024-08-11","2024-08-13"
"Катя","Ukraine","10","","Вже другий раз зупиняюсь тут  все як завжди ідеально чистенько і комфортно  величезний плюс простоті заселення.","Все сподобалось та просто є як пропозиція до покращення - надавати якусь не дорогу питну водичку при заселенні  може як платну послугу мінібару. Іноді складно заселятися вчасно  а вночі з комендантською вже не вийдеш в магазин  якщо не подумав завчасно)","2024-08-15","Superior Double Room","2024-08-07","2024-08-10"
"Sukhareva","Ukraine","10","Чудове місце без перебільшення 👌🏻","Чудові апартаменти в серці самого Львова ❤️ Чисто  без будь-яких запахів приміщення  просто чудово  не знаю що ще можна сказати  але точно впевнена  що наступні рази будемо зупинятися у Вас і радити будемо друзям 🤗","Не було такого","2024-08-14","Superior Double Room","2024-08-11","2024-08-14"
"Kobilnyk","Ukraine","10","","Умови прекрасні. Все чистенько і затишно","","2024-08-13","Superior Double Room","2024-08-12","2024-08-13"
"Олег","Ukraine","10","Все на своїх місцях та порядок. Задоволені від проживання та потрапляння до номеру через код.","Все було зручно та приємно проживати. Зручна гардеробна при вході. Чайник  кава та чай  цукор вразили  були додатково. В кожній зоні номеру зручне освітлення. Ліжко та постіль м яке та комфортне.","Були відсутні однаразові капці для готелів. Кімната маленька  то ходілось переодягнутись к в капці  щоб не забруднювати підлогу.","2024-08-13","Superior Double Room","2024-08-04","2024-08-06"
"Hlib","Ukraine","4","Чудове розташування  чисто  але дуже душно","Чистота  розташування  нові меблі","Попри всі неодмінні плюси помешкання в номері неможливо знаходитися через страшну духоту. В помешкання буквально не потрапляє повітря. На вулиці було десь 26°  що не дуже багато  але при цьому дихати було нічим. Доводилося відкривати вікно і двері одночасно  щоб створити хоч якийсь протяг. Спати вночі було дуже важко  вдень не хотілося повертатися додому. Це не просто відсутність кондиціонера  про що вказано в оголошенні  це саме відсутність повітря і будь якої вентиляції.","2024-08-13","Superior Double Room","2024-08-10","2024-08-12"
"Ольга","Ukraine","10","Другий раз повернулась би точно. Дякую господарям.","Все просто супер. Гарна локація  дуже чисто  безконтактне заселення. Є косметика  міні кухня   необхідний посуд.Свіжий ремонт.","Для ідеалу можно змінити рушники  вони вже застарі.","2024-08-11","Comfort Triple Room","2024-08-08","2024-08-10"
"Лісіца","Ukraine","10","","Локація просто чудова самий центр але вікна у маленький тихий дворик.","Виїзд о 10 годині дуже зарано особливо з дитиною. Але у номері було чисто тож розумію що на це треба час","2024-08-09","Comfort Triple Room","2024-08-04","2024-08-08"
