автор,нація,рахунок,назва,Позитивні відгуки,Негативні відгуки,Дата коментаря,Тип кімнати,Дата заїзду,Дата виїзду
"Дмитро","Ukraine","9","Варто заселятись!","Місцерозташування  стан мебелі  велике простроне лібко  чістий сан вузол.","Блокування майже всіх інтернет ресурсів на телевізорі  ну дуже тонкі стіни.","2024-02-09","Superior Double Room","2024-02-05","2024-02-09"
"Анна","Ukraine","10","зручне розташування  все чистенько та охайно  є все що треба для комфорту навіть більше. однозначно","зручне розташування  все чистенько та охайно  є все що треба для комфорту навіть більше. однозначно раджу)","","2024-01-27","Superior Double Room","2024-01-25","2024-01-27"
"Юлія","Ukraine","10","Найкращі апартаменти в центрі міста!!","Чистота на вищому рівні! Номер прибирають на совість. Є все необхідне   щоб щось приготувати і випити чаю і кави. Так расположення номеру в самому центрі  дуже зручно. Гарний вид з вікна. І не може не радувати безконтактне заселення.","Розумію  що прибирання номерів займає багато часу. Але хотілося б трошки більше часу зранку  не до 10 виселення. А так все пречудово.","2024-01-23","Deluxe Studio","2024-01-18","2024-01-19"
"Katerina","Ukraine","9","","Чистота та зручності","Сусіди  які дуже шуміли","2024-01-08","Deluxe Studio","2023-12-11","2023-12-12"
"Khtystyna","Ukraine","10","","Тепло  чисто та гарне розташування. Було все що потрібно для проживання.","","2024-01-07","Comfort Quadruple Room","2024-01-03","2024-01-06"
"Любов","Uruguay","10","Все добре!","Хороша квартира  ідеальне місце розташування  чиста з  сучасною постільною білизною і рушниками  є мінімальний посуд  відкривачка  прибори  електрочайник. Працюючий вайфай  безперебійна гаряча і холодна вода. Нам все сподобалося  дякуюємо! Будемо бронювати ще!","Що комунікація виключно через букінг. Були питання  відповіді на які хотілося б отримати відразу.","2024-01-02","Superior Double Room","2023-12-27","2023-12-29"
"Софія","Ukraine","10","❤️можу рекомендувати друзям :) і повернусь ще раз ❤️‍🔥","все сподобалось  ніяк не потрібно звʼязуватись з власником  вхід по пін коду котрий власник присилає в день заселення зранку. дуже зручно! якщо є питання можна зателефонувати :)  є рушники(3-5шт) праска дошка для прасування  чайник  стакани  чашки кімнатні капці 3пари  міні холодильник. чудовий душ  перепадів температури води немає  шампунь і гель для тіла. телевізор з нетфліксом  вайфай чудовий. виходите з підʼїзду і відразу потрапляєте на вуличку всіяну закладами!","","2023-12-27","Comfort Quadruple Room","2023-12-24","2023-12-27"
"Наталія","Ukraine","10","","Номер-кімната  розташований в самому центрі  для нас це було актуально.Ми приїхали ввечері  і нам хотілося погуляти по вечірньому Львові. Номер маленький  але все   щоб переночувати комфортно було. Немає людського фактору передачі і очікування ключів  коди.Все зручно.Нам сказали час заселення та виселення .І ніхто ні під кого не підлаштовувався . На фото все як в оригіналі .Нам сподобалося.","","2023-12-27","Superior Double Room","2023-12-21","2023-12-22"
"Тетяна","Ukraine","9","Малесенькі  але комфортні апартаменти. Чистота та зручності на високому рівні.","Загалом враження приємні - чиста квартира з хорошим ремонтом у самісінькому центрі. Усі зручності є. У помешканні приємно проводити час.","У квартирі трохи холодно  хоча  це  мабуть  властиво усім квартам у центрі. Господарям спасибі  що подбали про додаткові засоби обігріву.  Також  доволі шумно - у під‘їзді проводились ремонті роботи із самого ранкую. Можливо  лише нам так пощастило))","2023-12-18","Superior Double Room","2023-12-12","2023-12-14"
"Kyzmin","Ukraine","10","","Дуже сподобався номер чисто просторо розташування чудове. Рекомендую.","","2023-12-10","Comfort Quadruple Room","2023-12-08","2023-12-10"
"Oleh","Ukraine","9","дуже добре","Чудове розташування  дистанційне заселення  продуманий до дрібниць номер  чистота  надзвичайний краєвид  як завжди проживання дуже комфортне  затишне","","2023-12-04","Comfort Quadruple Room","2023-12-03","2023-12-04"
"Вильхова","Ukraine","8","Найгірше враження від розмови з власницею чи прибиральницею  я так і не зрозуміла хто то був.  За день до поїздки подзво","Розташування супер  сама квартира сучасна та гарний дизайн )","Найгірше враження від розмови з власницею чи прибиральницею  я так і не зрозуміла хто то був.  За день до поїздки подзвонила щоб дізнатись всі деталі  як потратили в кВ  натомість отримала відповідь «і що ?»  «завтра все прийде в смс  допобачення.»  По приїзду не знайшла ще комплекта постільної білизни  набрала за номером і знову та жіночка « так а може ви подивитесь в дивані  всередині перед тим як дзвонити ??»  Це така неповага.. дуже хамське спілкування","2023-12-03","Deluxe Studio","2023-12-01","2023-12-03"
"Karina","Ukraine","10","Залишились усім задоволені  щиро рекомендую!","Розташування ідеальне  в самому центрі","","2023-11-29","Superior Double Room","2023-10-30","2023-11-01"
"Oleh","Ukraine","10","чудово","заселення  смарт-простір  продуманість до дрібниць  аксесуари  приватність","немає","2023-11-25","Superior Double Room","2023-11-24","2023-11-25"
"Вікторія","Ukraine","5","Багато обурень  але хороше місцезнаходження та чиста квартира","Місцерозташування","Відношення хазяїв до проживаючих. Дзвонять з претензіями  що не оплатили проживання  при тому що тільки вʼїхали  і якби не зробили фото оплати то вигнали б на вулицю (скріни оплати програма не дає зробити). Холодильник  телевізор не працює. Дуже шумно  але в квартирі чисто","2023-11-20","Superior Double Room","2023-11-17","2023-11-19"
"Ксенія","Ukraine","10","Комфортний відпочинок","Мінімалістичний дизайн та чистота  все як треба для відпочинку! Чудове місце розташування. Хочемо приїхати ще раз!","","2023-11-10","Comfort Quadruple Room","2023-11-06","2023-11-09"
"Yulia","Ukraine","8","Дуже чисто і дуже зручно!","Відмінне розташування. Дуже комфортне ліжко. Все добре облаштовано  незважаючи на невеликий розмір номеру  у ньому було все необхідне. Дуже чисто. Ввечері віддалено чути спів вуличних музикантів  це лише додало настрою.","В останній день перебування зʼявився запах з каналізації. Можливо через ремонтні роботи на поверху нижче. Не смертельно  загального враження не зіпсувало.","2023-11-03","Superior Double Room","2023-10-31","2023-11-03"
"Бредшоу","Ukraine","10","","Фото повністю відповідає дійсності. В квартирі є абсолютно все  для комфортного проживання. Дуже зручне місце розположення  всі заклади поруч. Було чудово! Однозначно рекомендуємо!","","2023-11-02","Deluxe Studio","2023-11-01","2023-11-02"
"Марія","Ukraine","10","","Охайно  чисто  стильно  досить просторо. Є все необхідне для комфорту. Безключовий доступ це дуже зручно. Розташування просто топ! Поряд всі найкращі локації і заклади Львова.","","2023-10-26","Comfort Quadruple Room","2023-10-23","2023-10-26"
"Яна","Ukraine","10","Дуже зручно  стильний дизайн  дуже комфортне проживання","Дуже зручно  стильний дизайн  дуже комфортне проживання","","2023-10-24","Comfort Quadruple Room","2023-10-21","2023-10-23"
"Агаєва","Ukraine","10","","Очень тепло красивый вид чисто уютно кровать очень мягкая душ чистенький вода супер напор тоже ну не к чему придраться.Очень удобная система с кодами никто ""левый не заходил""  спокойно оставили коляску на первом этаже.Шумоизоляция отличная видели соседей но ни звука постороннего не слышали.очень понравилось!","Из-за того что делается ремонт заселили на четвертый этаж а мы курильщики 😁 приходилось каждый раз спускаться.Это единственный минус.Но возможно это и плюс так как во Львове съели много круасанов  нужно было кардио🤣","2023-10-18","Comfort Quadruple Room","2023-10-15","2023-10-17"
"Rinat","Ukraine","10","Класне місце","Все було дуже чудово! Рекомендую","Все було супер! Рекомендую!","2023-10-10","Superior Double Room","2023-10-03","2023-10-04"
"Maria","Ukraine","10","","Очень удобное месторасположение  прямо в историческом центре города. До многих достопримечательностей не составит особого труда дойти пешком. Номер уютный и оснащён всем необходимым для проживания) Остались очень довольны  с удовольствием приедем ещё 😊","","2023-10-08","Superior Double Room","2023-10-04","2023-10-07"
"Yelyzaveta","Ukraine","7","Непоганий варіант ціна - якість  але через звукоізоляцію важко обрати знову","Номер дуже чистий  було все необхідне  гарний ремонт. Розміщення готелю в самому центрі  3 хвилини до Площі Ринок.","У будівлі немає ліфту і треба підійматись з валізою пішки на 4 поверх крутими сходами. Звукоізоляції немає взагалі  було чутно кожен діалог людей зі всіх сторін.","2023-10-04","Superior Double Room","2023-10-02","2023-10-04"
"Vladyslav","Ukraine","10","Якщо будемо їхати ще раз  то тільки туди.","Окрема квартира зі всіма зручностями (чай  кава  мікрохвильовка  електроплита  електрочайний  холодильник  праска  вайфай  душова). у відмінному стані  виконана з дизайнерським смаком. Добре освітлена. Все легко.","Хоча у номері є смарт ТВ  але не варто розраховувати  дуже погано тягне. Немовби високий пінг. Відгук на дії з великими затримками  якщо взагалі є. Але враховуючи хороший вай-фай  у тому числі 5G  це не є проблемою.","2023-09-18","Deluxe Studio","2023-09-13","2023-09-16"
"Shcherbak","Ukraine","9","Задоволенний бронюванням саме цих апартаментів  однозначно рекомендую)","інтерʼєр  чистота  простора душова  зручне заселення. фото відповідають реальності  а також приємно порадувало наявність smartTV😅","","2023-09-10","Comfort Quadruple Room","2023-09-08","2023-09-09"
"Anna","Ukraine","7","","Хорошая локация  самый центр города. Уютные апартаменты.","Администратор данных апартаментов ничего не знает о сервисе и элементарных правилах общения с гостями.  Безумно душное помещение и не иметь кондиционера просто абсурд. Стоит маленький вентилятор  но он не справляется даже на 5%. Находится не возможно  а спать тем более.","2023-08-28","Deluxe Studio","2023-08-22","2023-08-23"
"Svitlana","Ukraine","10","","Зручне самостійне заселення  Чисті  сучасні  номера","","2023-08-25","Deluxe Studio","2023-08-23","2023-08-24"
"Tetiana","Ukraine","10","Місто зачарувало","Чистота та місцезнаходження","Відсутність кондиціонера. За день будівля нагрілася до того  що вночі поспати так і не вдалося","2023-08-23","Superior Double Room","2023-08-22","2023-08-23"
"Kateryna","Ukraine","10","дуже стильна та затишна квартира! дуже чисто! розташування у самому центрі","чиста та затишна квартира","немає кондиціонеру","2023-08-20","Comfort Quadruple Room","2023-08-15","2023-08-16"
"Valentina","Ukraine","10","Вся сім'я задоволена. Радимо для бронювання.","Дуже зручне розташування. Незважаючи на невеликі розміри апартаменту  перебувати в ньому було зручно  все продумано до деталей. Інтер'єр новий та сучасний. Також хочу відмітити чистоту та комфорт. Фото на сайті абсолютно відповідають реальності.","Все було чудово.","2023-08-17","Comfort Quadruple Room","2023-07-23","2023-07-27"
"Liudmyla","Ukraine","10","Рекомендую","Місцезнаходження просто в центрі  навкруги море кафешок  із самого ранечку можна вже випить по сусідству смачну каву і зїсти гарячого круасана","Дуже зручне ліжко) чистий і стильний номер","2023-08-13","Comfort Quadruple Room","2023-08-11","2023-08-13"
"Александра","Ukraine","9","Мы бы остановились там еще  все понравилось  надеемся что выселение возможно будет и позже  хотя бы до 12:00","Хорошая уютная комната  в самом центре города  все удобства есть  все чисто.","Не понравилось что очень ранее выселение  с 6 до 10 утра  так как к примеру мы были с большими сумками  поезд у нас в 8 вечера  Мы не успели даже позавтракать  так как нужно было быстро выселится  с дальней дороги не выспались.","2023-08-06","Superior Double Room","2023-07-30","2023-07-31"
"Tetiana","Ukraine","8","","","Нажаль не було інтернету  також телебачення не працювало","2023-08-04","Superior Double Room","2023-08-01","2023-08-02"
"Діна","Ukraine","10","","Дуже комфортне житло  це однозначно  краще з тих всіх помешкань  в яких ми зупинялись до цього Простора душова та туалет  є місце для того  щоб поставити свої крема та косметику Продумана кухня  є все необхідне  навіть сіль  цукор та кава Однозначно рекомендую це помешкання!","","2023-08-03","Deluxe Studio","2023-07-29","2023-07-31"
"Denistrel","Ukraine","9","Абсолютно відвертий рекомендасьйон","Прекрасне розташування  на паралельній вулиці від площі ринок  що по суті ще краще  адже менше шуму. Не зустрічав житло з настільки хорошим співвідношенням ціни та якості.","Трохи душно в кімнаті  оскільки сонячна сторона. Доводиться постійно мати увімкнений вентилятор  адже кондиціонеру немає. Трубачі під вікнами знають лише три мелодії  але це не камінь в сторону готелю.","2023-08-01","Superior Double Room","2023-07-02","2023-07-05"
"Daria","Ukraine","9","Остались очень довольны","Апартаменты в центре на очень красивой улице  сразу под подъездом куча разных заведений  не смотря на маленькое пространство  есть все необходимое  можно с животными","Выселение до 10 утра","2023-08-01","Superior Double Room","2023-07-27","2023-07-30"
"Anastasia","Ukraine","8","Чудовий варіант для коротенької поїздки","Комфортні невеличкі апартаменти в самому центрі. Чисто та охайно  сучасний ремонт  зручне безконтактне заселення. Для трьох людей нам місця якраз вистачило. Круто  що всюди кодові/цифрові замки та не потрібно переживати за ключі. Одразу біля будинку є маленький скверик з фонтаном біля якого можна посидіти попити кави  вранці там дуже тихо та мило. Навколо багацько закладів та магазинчиків.","Ми очікували  що під будинком буде досить гучно та людно вечорами  але з відчиненими вікнами таке відчуття  що тусовки прямо у тебе в кімнаті. В цілому  вікна можна й не відчиняти  так як є невеличкий вентилятор  але в пекельну спеку він не дуже врятує. Після комендантської години - лотерея  іноді гулянки одразу закінчуються і настає повна тиша  тоді спати чудово  а іноді - поодинокі компанії продовжують гуляти під вікнами до 2-3 ночі. Періодично також чути тупіт сусідів. Але нам це не зіпсувало враження.","2023-07-29","Deluxe Studio","2023-07-26","2023-07-29"
"Инна","Ukraine","9","Все супер","Все","Все добре було","2023-07-28","Superior Double Room","2023-07-26","2023-07-28"
"Oleh","Ukraine","10","Гарні апартаменти","Все","","2023-07-27","Superior Double Room","2023-07-26","2023-07-27"
"Evgeniy","Ukraine","9","","Чисте приміщення  дуже охайне з приємним дизайном","Нема кондиціонера  а в іншому все чудово","2023-07-23","Comfort Quadruple Room","2023-07-21","2023-07-23"
"Kosenko","Ukraine","10","Кайф","Чистота місце розташування гарний охайний номер","Під'їзд","2023-07-22","Superior Double Room","2023-07-19","2023-07-22"
"Olha","Ukraine","10","","Апартаменти знаходяться в самому центрі міста. Є все необхідне для комфортного проживання. Дуже зручна система доступу та заселення","","2023-07-22","Superior Double Room","2023-07-19","2023-07-21"
"Марія","Ukraine","10","Супер  повернусь ще з радістю","Дуже стильний ремонт  зручне величезне ліжко  широке підвіконня з подушкою  нетфлікс))","Якби була з важкою валізою – сходи стали б перепоною. Але я була лише з рюкзаком тож лишилась задоволена","2023-07-14","Superior Double Room","2023-06-09","2023-06-12"
"Валерія","Ukraine","7","В цілому непогано  але спати треба або в душному номері або з криками з тусівок людей навіть після коменданської","Чисто  комфортно  самісінький центр  новий ремонт","Не було капців  навіть після коменданської години дуже шумно якщо відчинити вікно  не відчиняти вікно не можливо  в номері дуже душно","2023-07-13","Superior Double Room","2023-07-07","2023-07-09"
"Lidiya","Ukraine","10","Рекомендую","Розташування відмінне  в центрі  в затишному провулочку.","Відсутність водички питної","2023-07-11","Deluxe Studio","2023-07-10","2023-07-11"
"S","Ukraine","10","","Все дуже зручно  чисто  гарний інтерʼєр. Обовʼязково сюди повернемось! Дякуємо за такий сервіс!","","2023-07-07","Superior Double Room","2023-07-06","2023-07-07"
